<?xml version="1.0" encoding="utf-8"?>

<page xmlns="http://www.w3schools.com" xmlns:xsi="http://www.w3.org/2001/XMLSchema-instance" xsi:schemaLocation="http://www.w3schools.com page.xsd" prev="Q3">

	<title>These are links to different questions!</title>
	<!-- Buttons to different questions & galleries -->
	<navigation-button destination="Q1">Question 1</navigation-button>
	<navigation-button destination="Q2">Question 2</navigation-button>
	<navigation-button destination="Q3">Question 3</navigation-button>
	<navigation-button destination="Q4">Question 4</navigation-button>
	
	<!-- The Galleries -->
	<gallery width="700" height="600">
		<image filename="4.png" />
		<image filename="5.png" />
		<image filename="bunny.jpg" />
	</gallery>
		
	<!-- The Question -->	
	<title>Question 1</title>
    <popup-button text="Random text">
        <subtitle>Incorrect!</subtitle>
    </popup-button>

    <popup-button text="More random text">
        <subtitle>Incorrect</subtitle>
    </popup-button>

    <popup-button text="more random textx20">
        <subtitle>Incorrect</subtitle>
    </popup-button>

    <popup-button text="hpidhasjidhaspdoj">
        <subtitle>Correct!</subtitle>
    </popup-button>

</page>