<?xml version="1.0" encoding="utf-8"?>

<page xmlns="http://www.w3schools.com" xmlns:xsi="http://www.w3.org/2001/XMLSchema-instance" xsi:schemaLocation="http://www.w3schools.com page.xsd" prev="home" next="Q2">
	
	<title>These are links to different questions!</title>
	<!-- Buttons to different questions & galleries -->
	<navigation-button destination="Q1">Question 1</navigation-button>
	<navigation-button destination="Q2">Question 2</navigation-button>
	<navigation-button destination="Q3">Question 3</navigation-button>
	<navigation-button destination="Q4">Question 4</navigation-button>
	
	<!-- The Galleries -->
	<gallery width="700" height="600">
		<image filename="bun.jpg" />
		<image filename="butt.jpg" />
		<image filename="5.png" />
	</gallery>
		
	<!-- The Question -->	
	<title>Question 1</title>
    <popup-button text="Butterflys">
        <subtitle>Incorrect!</subtitle>
    </popup-button>

    <popup-button text="2 Butterflys">
        <subtitle>Incorrect</subtitle>
    </popup-button>

    <popup-button text="3 Butterflys">
        <subtitle>Incorrect</subtitle>
    </popup-button>

    <popup-button text="4 Butterflys">
        <subtitle>Correct!</subtitle>
    </popup-button>

</page>