<?xml version="1.0" encoding="utf-8"?>

<page xmlns="http://www.w3schools.com" xmlns:xsi="http://www.w3.org/2001/XMLSchema-instance" xsi:schemaLocation="http://www.w3schools.com page.xsd" next="quizExample" prev="home">
	<title>Quiz</title>
	<text>Scroll down to see the quiz, we've provided the gallery for some help too</text>
<tabs>
		<tab name="Bunnies">
			<subtitle>Bunnies</subtitle>
			<gallery width="700" height="600">
				<image filename="bun.jpg" />
				<image filename="butt.jpg" />
				<image filename="5.png" />
			</gallery>
		</tab>
		<tab name="Butterflys">
			<subtitle>Butterflys</subtitle>
			<gallery width="700" height="600">
				<image filename="butt.jpg" />
			</gallery>
		</tab>
		<tab name="A French Man">
			<subtitle>A French Man</subtitle>
			<gallery width="700" height="600">
				<image filename="bunny.jpg" />
				<image filename="bunny-2.jpg" />
				<image filename="bunny-3.jpg" />
				<image filename="bunny-4.jpg" />
			</gallery>
		</tab>
		<tab name="Something Really Cool">
			<subtitle>Something Really Cool</subtitle>
			<gallery width="700" height="600">
				<image filename="4.png" />
				<image filename="5.png" />
				<image filename="bunny.jpg" />
			</gallery>
		</tab>

	</tabs>

	<title>What's that man holding?</title>
    <popup-button text="Butterflys">
        <subtitle>Incorrect!</subtitle>
        <text>No he isn't, this is a butterfly</text>
        <image filename="butt.jpg"/>
    </popup-button>

    <popup-button text="A human head">
        <subtitle>No!</subtitle>
        <text>No, that would be insane. Who puts pictures like that in places?</text>
    </popup-button>

    <popup-button text="The letter G">
        <text>Who wrote this quiz?</text>
    </popup-button>

    <popup-button text="Hamburg">
        <subtitle>Correct!</subtitle>
        <text>Hamburg is the second largest city in Germany. Well done!</text>
    </popup-button>

</page>