<?xml version="1.0" encoding="utf-8"?>

<page xmlns="http://www.w3schools.com" xmlns:xsi="http://www.w3.org/2001/XMLSchema-instance" xsi:schemaLocation="http://www.w3schools.com page.xsd">
	<title>This is a title.</title>
	<subtitle>This is a subtitle.</subtitle>
	<text>This is some text...Sed scelerisque, eros vel tincidunt euismod, eros erat pharetra nisl, id mattis elit arcu varius tellus. Suspendisse laoreet elit ac diam hendrerit, quis sollicitudin nisi maximus. In ornare urna ut dui bibendum tincidunt. Fusce vitae ante tincidunt, fermentum orci in, sodales dui. Aliquam et tellus enim. Class aptent taciti sociosqu ad litora torquent per conubia nostra, per inceptos himenaeos. Ut vehicula nisl eget lectus scelerisque, sed sodales erat dapibus. Morbi vel tellus eros. Maecenas lacinia nibh sed finibus rhoncus. Suspendisse enim leo, tempor eget tempor eget, molestie in felis. In id diam velit. Cras ex nisl, porttitor quis auctor non, lacinia id ligula. Cras lacinia orci a nunc rhoncus pretium. Quisque rhoncus orci at lectus pretium dapibus. Nulla blandit quam nec auctor sagittis.</text>
	<image filename="icon.ico" width="64" height="64" />
	<gallery width="256" height="256">
		<image filename="0.jpg" />
		<image filename="1.jpg" />
		<image filename="2.jpg" />
		<image filename="3.png" />
		<image filename="4.png" />
		<image filename="5.png" />
	</gallery>
</page>